<?xml version="1.0" encoding="UTF-8"?>
<users xmlns="https://github.com/XML-TIM4/ScientificPublications"
 xmlns:xsi="http://www.w3.org/2001/XMLSchema-instance"
 xsi:schemaLocation="https://github.com/XML-TIM4/ScientificPublications file:/D:/ScientificPublications/Backend/data/schemas/Users.xsd">
    <user author-id="" is-editor="false">
        <username>nfq5E8</username>
        <password>^#641U#*HX*i#*3$</password>
        <email>!@#.af</email>
        <publication-roles>
            <publication-role document-id="" role="AUTHOR"/>
            <publication-role document-id="T:/s" role="REVIEWER"/>
        </publication-roles>
    </user>
    <user author-id="" is-editor="false">
        <username>Iu0NJVilkqB6TY9z</username>
        <password>^*GLf#zo**#T#B#b$</password>
        <email>?+¬ù@).ao</email>
        <publication-roles>
            <publication-role document-id=" #&amp;\" role="AUTHOR"/>
            <publication-role document-id="" role="REVIEWER"/>
        </publication-roles>
    </user>
</users>
